{
  "archsift_version_or_commit": "75fb242e2207486dd52cd356f07966dc86790f6c",
  "corpus_version": "1.0.0",
  "method_version": "1.2.0",
  "overall_result": "not-met",
  "protocol_version": "2.0.0",
  "ruleset_version": "1.8.0",
  "schema_version": 2,
  "sessions": [
    {
      "agent_model": "deepseek-v4-flash",
      "agent_product": "claude-code",
      "disagreements": [],
      "environment": {
        "install_mode": "source-checkout",
        "operating_system": "macos",
        "python_version": "3.14.7"
      },
      "examples": [
        {
          "decision_areas": [
            {
              "candidate_ids": [
                "adaptive-agent",
                "human-review",
                "fixed-workflow"
              ],
              "decision_area": "problem-value",
              "evidence_ids": [
                "decision-observed"
              ],
              "rule_ids": [
                "binding-outcome-met",
                "binding-outcome-failed",
                "binding-constraint-met"
              ],
              "trace_outcome": "causal",
              "verdict_rule_id": "verdict-supported"
            },
            {
              "candidate_ids": [
                "adaptive-agent"
              ],
              "decision_area": "agency-necessity",
              "evidence_ids": [
                "agency-observed"
              ],
              "rule_ids": [
                "agentic-dynamic-execution-supports-agency",
                "agentic-runtime-adaptation-supports-agency",
                "agentic-feedback-supports-agency",
                "agentic-fixed-workflow-insufficiency-supports-agency",
                "agentic-residual-case-supports-agency",
                "agentic-agency-fact-non-decisive"
              ],
              "trace_outcome": "causal",
              "verdict_rule_id": "verdict-supported"
            },
            {
              "candidate_ids": [
                "adaptive-agent",
                "fixed-workflow"
              ],
              "decision_area": "autonomy-permission",
              "evidence_ids": [
                "autonomy-observed"
              ],
              "rule_ids": [
                "autonomy-boundary-non-decisive"
              ],
              "trace_outcome": "explicitly-non-decisive",
              "verdict_rule_id": "verdict-supported"
            },
            {
              "candidate_ids": [
                "adaptive-agent",
                "human-review",
                "fixed-workflow"
              ],
              "decision_area": "comparative-fit",
              "evidence_ids": [
                "decision-observed"
              ],
              "rule_ids": [
                "binding-outcome-met",
                "binding-outcome-failed",
                "binding-constraint-met"
              ],
              "trace_outcome": "causal",
              "verdict_rule_id": "verdict-supported"
            }
          ],
          "decision_record_identity": "sha256:cb0bde345fd877d1638739d30cad95026799fa0222a1477480e7e2f3bacd31b1",
          "example_id": "agentic-control",
          "example_result": "pass"
        },
        {
          "decision_areas": [
            {
              "candidate_ids": [
                "fixed-workflow",
                "human-review"
              ],
              "decision_area": "problem-value",
              "evidence_ids": [
                "decision-observed"
              ],
              "rule_ids": [
                "binding-outcome-met",
                "binding-outcome-failed",
                "binding-constraint-met"
              ],
              "trace_outcome": "causal",
              "verdict_rule_id": "verdict-supported"
            },
            {
              "candidate_ids": [],
              "decision_area": "agency-necessity",
              "evidence_ids": [
                "agency-observed"
              ],
              "rule_ids": [
                "agentic-fixed-workflow-sufficient-blocks-candidate",
                "agentic-runtime-adaptation-missing"
              ],
              "trace_outcome": "display-only",
              "verdict_rule_id": null
            },
            {
              "candidate_ids": [
                "fixed-workflow"
              ],
              "decision_area": "autonomy-permission",
              "evidence_ids": [
                "autonomy-observed"
              ],
              "rule_ids": [
                "autonomy-boundary-non-decisive"
              ],
              "trace_outcome": "explicitly-non-decisive",
              "verdict_rule_id": "verdict-supported"
            },
            {
              "candidate_ids": [
                "fixed-workflow",
                "human-review"
              ],
              "decision_area": "comparative-fit",
              "evidence_ids": [
                "decision-observed"
              ],
              "rule_ids": [
                "binding-outcome-met",
                "binding-outcome-failed",
                "binding-constraint-met"
              ],
              "trace_outcome": "causal",
              "verdict_rule_id": "verdict-supported"
            }
          ],
          "decision_record_identity": "sha256:f6287b44f3ca7cad99ac8990d704d54c7f8115c694f4856395859ba9f9bee77c",
          "example_id": "fixed-workflow",
          "example_result": "fail"
        },
        {
          "decision_areas": [
            {
              "candidate_ids": [
                "human-review",
                "fixed-workflow"
              ],
              "decision_area": "problem-value",
              "evidence_ids": [
                "decision-observed"
              ],
              "rule_ids": [
                "binding-outcome-failed",
                "candidate-test-result-unknown",
                "binding-constraint-met"
              ],
              "trace_outcome": "causal",
              "verdict_rule_id": "verdict-insufficient-evidence"
            },
            {
              "candidate_ids": [],
              "decision_area": "agency-necessity",
              "evidence_ids": [
                "agency-observed"
              ],
              "rule_ids": [
                "agentic-fixed-workflow-sufficient-blocks-candidate",
                "agentic-runtime-adaptation-missing"
              ],
              "trace_outcome": "display-only",
              "verdict_rule_id": null
            },
            {
              "candidate_ids": [
                "fixed-workflow"
              ],
              "decision_area": "autonomy-permission",
              "evidence_ids": [
                "autonomy-observed"
              ],
              "rule_ids": [
                "autonomy-boundary-non-decisive"
              ],
              "trace_outcome": "explicitly-non-decisive",
              "verdict_rule_id": "verdict-insufficient-evidence"
            },
            {
              "candidate_ids": [
                "human-review",
                "fixed-workflow"
              ],
              "decision_area": "comparative-fit",
              "evidence_ids": [
                "decision-observed"
              ],
              "rule_ids": [
                "candidate-test-result-unknown",
                "comparison-result-unknown",
                "binding-outcome-failed",
                "binding-constraint-met"
              ],
              "trace_outcome": "causal",
              "verdict_rule_id": "verdict-insufficient-evidence"
            }
          ],
          "decision_record_identity": "sha256:d6ce588dc5ba2c0df4d18db55dd8147b129a1ee373f5ad38166eaff245e8e6b7",
          "example_id": "insufficient-evidence",
          "example_result": "fail"
        },
        {
          "decision_areas": [
            {
              "candidate_ids": [
                "human-review",
                "process-redesign"
              ],
              "decision_area": "problem-value",
              "evidence_ids": [
                "decision-observed"
              ],
              "rule_ids": [
                "binding-outcome-met",
                "binding-constraint-met"
              ],
              "trace_outcome": "causal",
              "verdict_rule_id": "verdict-no-technology-change"
            },
            {
              "candidate_ids": [],
              "decision_area": "agency-necessity",
              "evidence_ids": [
                "agency-observed"
              ],
              "rule_ids": [
                "agentic-fixed-workflow-sufficient-blocks-candidate",
                "agentic-runtime-adaptation-missing"
              ],
              "trace_outcome": "display-only",
              "verdict_rule_id": null
            },
            {
              "candidate_ids": [],
              "decision_area": "autonomy-permission",
              "evidence_ids": [
                "autonomy-observed"
              ],
              "rule_ids": [
                "active-veto-blocks-candidate",
                "mandatory-human-control-retained"
              ],
              "trace_outcome": "display-only",
              "verdict_rule_id": null
            },
            {
              "candidate_ids": [
                "human-review",
                "process-redesign"
              ],
              "decision_area": "comparative-fit",
              "evidence_ids": [
                "decision-observed"
              ],
              "rule_ids": [
                "binding-outcome-met",
                "binding-constraint-met"
              ],
              "trace_outcome": "causal",
              "verdict_rule_id": "verdict-no-technology-change"
            }
          ],
          "decision_record_identity": "sha256:816ab5861b6d5f342b1b0150ef9994ca3a7e6548ea1708cd8b5873582bd22179",
          "example_id": "no-technology-change",
          "example_result": "fail"
        }
      ],
      "failure_reasons": [
        "display-only-decision-area"